{
  "archive_file_name": "P8-R1-final-evidence-private.tar.gz",
  "archive_member_count": 1490,
  "archive_sha256": "e9eea5fe520779eee4f4eba4df442ae46c0fd43ea382eed9f5ad5de94cbd14b6",
  "archive_size_bytes": 639729,
  "estimator_deserialized": false,
  "experiment_executed": false,
  "metric_recalculated": false,
  "next_milestone": "P8-R2",
  "receipt_id": "p8_r1_private_archive_receipt_v1",
  "registry": {
    "path": "plans/phase8/P8_R1_FINAL_EVIDENCE_REGISTRY_V1.json",
    "registry_id": "p8_r1_final_evidence_registry_v1",
    "sha256": "12394870c20177f9530c422517483ca566476c93057b9ff3aa182a46764ba94d",
    "size_bytes": 954159
  },
  "runtime_artifact_count": 1488,
  "schema_version": 1,
  "source_checkpoint": {
    "branch": "main",
    "commit": "b1d8de5d9e2c8835b376004801ba849dfd88e8bf",
    "commit_short": "b1d8de5",
    "public_archive": "GIT_TRACKED_SOURCE_AT_CHECKPOINT"
  },
  "status": "VERIFIED"
}
